{
  "$schema": "http://json-schema.org/draft-06/schema",
  "type": "object",
  "properties": {
    "version": {
      "type": "number"
    },
    "success": {
      "type": "boolean"
    },
    "reason": {},
    "content": {
      "type": "object",
      "properties": {
        "href": {
          "type": "string"
        },
        "name": {
          "type": "string"
        },
        "description": {
          "type": "string"
        },
        "created_at": {
          "type": "string"
        },
        "updated_at": {
          "type": "string"
        },
        "update_type": {
          "type": "string"
        },
        "created_by": {
          "type": "object",
          "properties": {
            "href": {
              "type": "string"
            }
          }
        },
        "updated_by": {
          "type": "object",
          "properties": {
            "href": {
              "type": "string"
            }
          }
        },
        "ip_ranges": {
          "type": "array",
          "items": {
            "type": "object",
            "properties": {
              "from_ip": {
                "type": "string"
              },
              "exclusion": {
                "type": "boolean"
              },
              "to_ip": {
                "type": "string"
              }
            }
          }
        },
        "fqdns": {
          "type": "array",
          "items": {
            "type": "object",
            "properties": {
              "fqdn": {
                "type": "string"
              }
            }
          }
        }
      }
    },
    "raw": {},
    "inputs": {
      "type": "object",
      "properties": {
        "illumio_ip_list_ip_ranges": {
          "type": "string"
        },
        "illumio_ip_list_name": {
          "type": "string"
        },
        "illumio_ip_list_description": {
          "type": "string"
        },
        "illumio_ip_list_fqdns": {
          "type": "string"
        }
      }
    },
    "metrics": {
      "type": "object",
      "properties": {
        "version": {
          "type": "string"
        },
        "package": {
          "type": "string"
        },
        "package_version": {
          "type": "string"
        },
        "host": {
          "type": "string"
        },
        "execution_time_ms": {
          "type": "integer"
        },
        "timestamp": {
          "type": "string"
        }
      }
    }
  }
}