{
  "version": 2.0,
  "success": true,
  "reason": null,
  "content": {
    "ip_lists": [
      {
        "href": "/orgs/28/sec_policy/active/ip_lists/105",
        "name": "Any (0.0.0.0/0 and ::/0)",
        "created_at": "2021-06-29T17:13:12.054Z",
        "updated_at": "2021-06-29T17:13:12.064Z",
        "created_by": {
          "href": "/users/0"
        },
        "updated_by": {
          "href": "/users/0"
        },
        "ip_ranges": [
          {
            "from_ip": "0.0.0.0/0",
            "exclusion": false
          },
          {
            "from_ip": "::/0",
            "exclusion": false
          }
        ],
        "fqdns": []
      }
    ]
  },
  "raw": null,
  "inputs": {
    "illumio_max_results": 1,
    "illumio_ip_list_name": "Any (0.0.0.0/0 and ::/0)"
  },
  "metrics": {
    "version": "1.0",
    "package": "fn-illumio",
    "package_version": "1.1.0",
    "host": "C02G82JEMD6R",
    "execution_time_ms": 690,
    "timestamp": "2022-03-09 23:57:59"
  }
}