{
  "version": 2.0,
  "success": true,
  "reason": null,
  "content": {
    "href": "/orgs/28/sec_policy/active/enforcement_boundaries/1325",
    "name": "EB-IBM-SOAR-3389-TCP",
    "created_at": "2022-03-04T18:46:17.900Z",
    "updated_at": "2022-03-04T18:46:17.909Z",
    "created_by": {
      "href": "/users/520"
    },
    "updated_by": {
      "href": "/users/520"
    },
    "caps": [
      "write",
      "provision"
    ],
    "ingress_services": [
      {
        "port": 3389,
        "proto": 6
      }
    ],
    "providers": [
      {
        "actors": "ams"
      }
    ],
    "consumers": [
      {
        "ip_list": {
          "href": "/orgs/28/sec_policy/active/ip_lists/105"
        }
      }
    ]
  },
  "raw": null,
  "inputs": {
    "illumio_protocol": "TCP",
    "illumio_enforcement_boundary_providers": "ams",
    "illumio_enforcement_boundary_name": "EB-IBM-SOAR-3389-TCP",
    "illumio_port": 3389,
    "illumio_enforcement_boundary_consumers": "/orgs/28/sec_policy/active/ip_lists/105"
  },
  "metrics": {
    "version": "1.0",
    "package": "fn-illumio",
    "package_version": "1.1.0",
    "host": "C02G82JEMD6R",
    "execution_time_ms": 538,
    "timestamp": "2022-03-09 23:58:26"
  }
}